Id,index1,cluster,text,stance,stance_enc
https://www.thestar.com/news/world/2018/04/10/ex-russian-spys-daughter-released-from-uk-hospital-after-poisoning-attack.html,222,13,"LONDON—The spy saga that set off international tumult last month took a positive turn Tuesday as Yulia Skripal was released from a British hospital more than a month after she and her father were poisoned with a military-grade nerve agent.

“This is not the end of her treatment, but marks a significant milestone,” Salisbury District Hospital medical director Christine Blanshard said after the 33-year-old Skripal was discharged and taken to a secure location.

Blanshard would not provide details about Yulia Skripal’s condition for reasons of patient privacy. Sergei Skripal, 66, the apparent target of the March 4 attack, is recovering more slowly than his daughter but continues to improve, she said.

Read more:

Russia wants meeting with U.K.’s Boris Johnson as public feud over ex-spy poisoning continues

Poisoned ex-Russian spy no longer in critical condition, U.K. hospital says

Britain and U.S. spreading ‘lies and disinformation’ about poisoning of ex-spy: Russian foreign minister

No date has been set for his discharge, the doctor said.

“Both patients have responded exceptionally well to the treatment we’ve been providing. But equally, both patients are at different stages in their recovery,” she said.

The father and daughter were found unconscious on a bench and remained in critical condition for several weeks. Their poisoning has revived Cold War tensions between Russia and the West.

The British government is likely to keep details about Yulia Skripal’s location secret, given the sensitivity of the case. It accuses Russia of carrying out the attack, which Moscow vehemently denies.

If she is well enough, she is likely to be extensively questioned by British security officials and police about her recollection of events leading up to her poisoning.

The Russian Embassy in London tweeted its congratulations to Yulia Skripal, but said pointedly that Russia needs “urgent proof” that “what is being done to her is done on her own free will.”

The embassy accused British authorities of “concealing important evidence and blocking an impartial and independent investigation” by isolating the woman.

It reaffirmed its request for consular access to her. She is a Russian citizen.

It is not clear where the Skripals will live if they recover enough to resume normal activities. British officials may feel Sergei Skripal would not be safe to live openly in England any longer.

Bob Ayers, a security analyst who used to work with the CIA, said it is possible the Skripals would be given new identities in Britain or the United States under a program like those used to protect witnesses in high-profile criminal trials.

They could also choose to live in the open under the assumption that Russia would not attack a second time, he said.

“They may not want to go into hiding,” Ayers said. “Now that the assassination attempt has been uncovered, the odds are pretty good the Russians won’t take another run at them. They’ll be under surveillance, the cops will put cameras up, they’ll keep good track of the Skripals.”

He said he would not expect Yulia Skripal to return to Russia despite her Russian nationality.

In a later tweet, the Russian Embassy said any attempt to settle her in another country would be regarded as “abduction.”

British police say the lethal nerve agent Novichok was placed on the door handle of Sergei Skripal’s house in Salisbury, an English city 160 kilometres west of London.

The nerve agent also sickened Nick Bailey, a police detective who came to their aid. He was the first of the three to be released from the hospital.

Yulia Skripal arrived in England from Moscow the day before the attack to spend Easter with her father

Sergei Skripal is a former Russian military intelligence officer who was convicted in Russia of spying for Britain.

He was imprisoned in Russia and eventually settled in England after a 2010 “spy swap.”

He was living under his own name in Salisbury, apparently believing he would be safe because there was no known history of Russia attacking former spies who had been part of exchanges.

The British government maintains the Skripals were poisoned by a military-grade nerve agent that could only have been made in Russia. Russia has denied the allegation.

The incident has led to a mass expulsion of Russian diplomats from countries aligned with Britain. Russia in turn retaliated by expelling diplomats from countries that sided with Britain.

There are still many unanswered questions about the brazen attack.

If Britain is correct that the Russian government is to blame, it is not clear why Sergei Skripal was poisoned now, some eight years after his swap.

Some analysts believe Russian President Vladimir Putin wanted to send a message to others who had betrayed Russia that they are not safe anywhere in the world. Others believe Sergei Skripal might have been involved in some private business that made Russian officials uneasy.

British officials have also not revealed how the Novichok was brought into Britain.

Read more about:

SHARE:",neutral,1
http://www.businessinsider.com/jeremy-corbyn-does-not-believe-there-is-enough-proof-to-blame-russia-for-the-sergei-skripal-poisoning-2018-3,238,48,"Jeremy Corbyn is not yet prepared to blame Russia for the Sergei Skripal poisoning.

The Labour leader believes British intelligence officials could be wrong, according to his spokesperson.

Corbyn believes the attack could have been carried out by another eastern European state or the mafia.

Theresa May said she was ""surprised and shocked"" by the comments.

LONDON — Jeremy Corbyn believes there is not enough evidence to conclude that Russia was culpable for the poisoning of Sergei Skripal and his daughter.

Prime Minister Theresa May told the House of Commons today that Vladimir Putin's Russia was responsible for the attack in Salisbury last week and will be subject to a series of punitive measures.

However, shortly after May's speech, a spokesperson for Corbyn told publications including Business Insider that the Labour leader did not believe there was sufficient proof to conclude that Russia carried out the poisoning, suggesting that British intelligence services could be wrong.

""There is a history between weapons of mass destruction and intelligence which is problematic, to put it mildly,"" they said.

Asked why Corbyn did not explicitly condemn Russia in his response to the prime minister's Commons speech, they added: ""Clearly whoever carried out the attack is responsible for what was a completely heinous and reckless act.""

The spokesperson also suggested the poisoning might have been a carried out by a ""mafia"" or another former Soviet state, rather than orchestrated by the Kremlin.

""The break up of the Soviet state led to all sorts of material ending up in random hands,"" they said.

Prime Minister May said she was ""surprised and shocked"" by the Labour leader's statement and said most Labour MPs will be ""equally surprised"" by the spokesperson's comments.

A host of Labour MPs gave their full support to May's speech and suggested their leader should have been stronger in his condemnation of Russia.

Yvette Cooper said Russia ""must be met with unequivocal condemnation"" while Liz Kendall, John Woodcock and other Labour MPs echoed the prime minister's remarks.

Their Labour colleague Gavin Shuker MP tweeted:

Asked whether Corbyn was concerned by comments made by some of Labour MPs, his spokesperson said: ""In these kinds of cases, there are often initial reactions which aren't later backed up by reality or facts.""

Skripal and his daughter, Yulia, are in critical condition after being exposed to a military-grade nerve agent in Salisbury, south England last week.",neutral,1
http://www.bbc.com/news/uk-43387499,279,24,"She welcomed the decision to do so, saying: ""Given the gravity of these issues, it is... right that the authorities should reassure us that they have looked at any further allegations or relevant evidence put forward in any other cases.""",neutral,1
http://www.businessinsider.com/military-deployed-to-shopping-mall-where-sergei-skripal-was-poisoned-2018-3,314,257,"British troops were deployed to the Salisbury mall where an ex-Russian spy and his daughter were poisoned by a nerve agent.

The military was called in to remove cars and objects from the scene that may be contaminated.

UK Home Secretary Amber Rudd will chair an emergency Cobra meeting as the investigation into the source of the nerve agent continues.

Nearly 200 troops from the British Army, the Royal Air Force, and the Royal Marines were deployed on Friday to remove contaminated items from the shopping mall in Salisbury, England, where ex-Russian spy Sergei Skripal and his daughter Yulina were poisoned by a nerve agent.

Skripal, 66, and his daughter, 33, remain in critical condition at Salisbury hospital after they were found unconscious on a bench on Sunday, March 4.

The Counter-Terrorism Policing Network asked for the military's assistance to ""remove a number of vehicles and objects from the scene in Salisbury town centre,"" London's Metropolitan Police said in a news release. ""The public should not be alarmed and the public health advice remains the same,"" it added.

Counterterror investigators, who are treating the attack as attempted murder, have identified the type of nerve agent that the pair were exposed to, but they are not making it public yet.

Nerve agents are highly toxic chemicals that can kill people in minutes and are extremely hard to make.

A British police officer who responded to the scene was also seriously injured, but was ""talking and engaging"" as of Thursday morning.

On Saturday, UK Home Secretary Amber Rudd will chair an emergency Cobra meeting, the second since Wednesday, as the investigation into the source of the nerve agent continues, the BBC reports.",neutral,1
