Id,index1,cluster,text,stance,stance_enc
https://www.bloomberg.com/view/articles/2018-03-13/skripal-poisonings-are-an-eerie-throwback-to-the-soviet-era,831,24,"Why did this happen?

Please make sure your browser supports JavaScript and cookies and that you are not blocking them from loading. For more information you can review our Terms of Service and Cookie Policy.",neutral,1
http://www.bbc.co.uk/news/uk-politics-43405680,839,48,"Asked if Mr Corbyn, who opposed the then Labour government's backing for the Iraq War, was worried about being out of step with his party, the spokesman said Mr Corbyn had been ""right about a lot of things"" in the past two decades and the reaction of other MPs ""isn't always backed by the facts"".",neutral,1
http://www.bbc.co.uk/news/uk-england-london-43595404,868,637,"CJ Churchall-McKenzie, who was waiting to be seen for a broken foot, said no patients were allowed to be seen by medical staff after the ""lockdown"" was announced, for fear of contamination.",neutral,1
https://sputniknews.com/europe/201803151062578637-nato-stoltenberg-soviet-union/,897,657,"In a nutshell, for Stoltenberg, ""in an unpredictable world, the Alliance is stepping up to keep our nations safe.""

This was ""business as usual,"" but there was more. Stoltenberg dedicated nearly half the time of his press conference and the question time to the issue of poisoning of the former Russian spy Sergei Skripal in the United Kingdom. For him, there is no question that Russia is behind this poisoning with military-grade nerve agent. Stoltenberg noted that it was the first time such a weapon was used on the Alliance territory since NATO’s foundation.

Skripal and his daughter were found unconscious in Salisbury on March 4. They are currently being treated for exposure to a chemical substance, a military-grade nerve agent, according to UK experts.

Skripal Case

UK Prime Minister Theresa May condemned Russia in three sentences, without allowing Moscow to defend itself, and for Stoltenberg, there is no doubt, either, that Russia is to blame.

""The attack in Salisbury has taken place against the backdrop of a reckless pattern of Russian behaviour. Over many years. The illegal annexation of Crimea and military support to separatists in Eastern Ukraine. The military presence in Moldova and Georgia against these countries’ will. Meddling in Montenegro and elsewhere in the Western Balkans. Attempts to subvert democratic elections and institutions. And the military build-up from the North of Europe to the Middle East,"" Stoltenberg said.

Russian officials have rejected these claims, made time and again, repeatedly stressing that Russia does not interfere in other states' affairs and pointing out that the accusations are put forward without any evidence to support them.

Moscow has denied the allegations of involvement in this incident and offered its help in investigation. However, its request to be given access to the suspicious substance was denied.

READ MORE: 'Constellation of Political Actors' Exploiting Skripal Poisoning — Professor

Asked what NATO could do to support the United Kingdom, presented as a victim of Russian aggression, Stoltenberg said that London ""is not alone and NATO is ready to help, but no request has reached us yet for the investigation,"" without specifying precisely how NATO could help.

The secretary general then mentioned again the increased presence of NATO navies in the Black Sea, the four battle groups amassed by NATO on its Eastern borders, facing Russia, and the investment in cyberdefense. Aggressive talk, indeed, from NATO: more so than at any time in the recent past.

Back to USSR?

During the press conference, Stoltenberg mentioned that the poisonous substance, Novichok, was developed by Russia, although it was created more than 30 years ago in the Soviet Union.

It is unclear if the confusion between Russia and the Soviet Union was intentional, but the conflation is alarming, especially as it comes from the head of the Alliance. Moreover, the nerve agent could be recreated elsewhere. Nevertheless, it was implied that Russia's culpability was evident.

READ MORE: Russian Diplomats Receive Threats Over Alleged Skripal's Poisoning — Envoy to UK

Of course, at the end of his speech, Stoltenberg paid lip service to peace: ""NATO’s approach remains firm, defensive, and proportionate. NATO will not mirror Russia tank for tank, missile for missile or drone for drone."" He also said that the Alliance would continue to seek meaningful dialogue with Russia which, while ""difficult"", was still of immense importance.",neutral,1
https://sputniknews.com/world/201803141062507030-russia-skripal-incident/,938,48,"""Unfortunately London has chosen a language of ultimatums. I can say from the start that a language of ultimatums in relation to Russia doesn't work. Russia fears nothing. It has regrets, yes. I regretted to hear the debates in the British Parliament and the official statements. Instead this situation should be properly sorted out, Russia should have been invited to take part in the investigation,"" he told Euronews.

READ MORE: Ofcom Vows to Review Possible Measures Against RT Over Skripal's Case

UK Prime Minister Theresa May said on Monday that Russia was ""highly likely"" responsible for the recent nerve agent attack on Skripal as the substance used to poison Skripal and his daughter Yulia was identified as a military-grade nerve agent of the so-called Novichok group developed in Russia. In an ultimatum to Russia, May demanded an explanation for the poisoning by the end of Tuesday and threatened to apply harsh response measures.",neutral,1
http://www.independent.co.uk/news/world/europe/france-russia-macron-nerve-agent-poison-sergei-skripal-a8256876.html,940,685,"For free real time breaking news alerts sent straight to your inbox sign up to our breaking news emails Sign up to our free breaking news emails Please enter a valid email address Please enter a valid email address SIGN UP I would like to be emailed about offers, events and updates from The Independent. Read our privacy notice Thanks for signing up to the

Breaking News email {{ #verifyErrors }}{{ message }}{{ /verifyErrors }}{{ ^verifyErrors }}Something went wrong. Please try again later{{ /verifyErrors }}

Britain, the US, Germany, and France issued a joint response to the poisoning of Sergei Skripal and Yulia Skripal on Thursday afternoon, condemning Russia for the ""first offensive use of a nerve agent in Europe since the Second World War"".

But on Thursday morning and through Wednesday France had initially appeared more hesitant to line up behind Theresa May’s version of events, with Emmanuel Macron’s government taking a more careful approach.

On Wednesday Benjamin Griveaux, a spokesperson for the country’s government, said it was too early to decide on retaliatory measures against Russia, as its involvement was yet to be proven.

“We don't do fantasy politics. Once the elements are proven, then the time will come for decisions to be made,” he told a press conference shortly after Theresa May announced she would be expelling Russian diplomats over the poisoning.

The response apparently raised eyebrows in Westminster and elsewhere, where Theresa May’s analysis and approach has received stronger support. Anders Fogh Rasmussen, the former Nato chief, told the BBC that “anything short of full solidarity with the UK will be considered a victory by the Kremlin”.

The French government then put out another statement, this time as an “Elysee source”, which said: “France's solidarity with the UK is unquestionable.

“President Macron denounced as early as Tuesday the Salisbury chemical attack as unacceptable and assured Prime Minister May the UK had France's full support. Both leaders will discuss the matter yet again this Thursday.

“Since the beginning of this week, the UK has briefed its allies thoroughly, and France in particular, that it was highly likely that Russia was responsible for the attack.”

Saying you’ve been told something was highly likely, is of course, not the same as saying you believe it is true.

The French statement also contrasted with what the White House was saying at the time, with an unequivocal condemnation of what it said was Russian involvement: “The United States shares the United Kingdom’s assessment that Russia is responsible for the reckless nerve agent attack on a British citizen and his daughter,” a spokesperson said.

Donald Trump's administration is widely regarded as being close to Russia, so why were they ahead of France in condemning the attack? Key to understanding the different French response is the strategy taken by Emmanuel Macron to Russia and Vladimir Putin and the background to the two leaders’ relationship.

Mr Macron has always been keen not to isolate Russia on the international stage. He is making his first presidential trip to Russia in May, and has engaged directly with Mr Putin over Syria in a way that some other Western leaders have not, asking the president to help open humanitarian corridors and mooting the return of peace talks.

Britain's Prime Minister Theresa May addresses the House of Commons on her government's reaction to the poisoning of former Russian intelligence officer Sergei Skripal and his daughter Yulia in Salisbury (Parliament TV handout via REUTERS)

Last month the two leaders had a comprehensive discussion over the telephone in which they pledged to cooperate more closely, including on Syria. They have also tried to put the Ukraine conflict behind them. Mr Putin visited France in May of last year.

Diplomatically, preventing a leader from becoming isolated is a fairly standard approach to preventing the escalation of a conflict. But there are also increasingly important economic ties between the two countries, too.

Russian state media outlet RT reported earlier this month that trade between the two countries is booming, having risen by around a fifth in 2017 despite sanctions. France buys minerals from Russia, while Russia buys chemicals, machinery, and food from France.

Skripal attack aftermath – in pictures Show all 15 1 /15 Skripal attack aftermath – in pictures Skripal attack aftermath – in pictures Scene of attack Members of the emergency services in hazard suits fix the tent over the bench where Sergei and Yulia Skripal were found unconscious on a park bench in Salisbury in March 2018. Getty Skripal attack aftermath – in pictures Victim - Sergei Skripal The retired Russian colonel and former double agent for MI6 was in a critical condition in hospital for more than two months after being exposed to novichok in Salisbury. He was given refuge in the UK after being jailed in Moscow for treason. Mr Skripal came to Britain as part of a high-profile “spy swap” in 2010 in which four men were exchanged for ten Russian ""sleeper agents"" in the US. In this image he is speaking to his lawyer from behind bars in Moscow in 2006. AP Skripal attack aftermath – in pictures Victim - Yulia Skripal Yulia Skripal was struck down by a novichok poison alongside her father Sergei. Facebook Skripal attack aftermath – in pictures Scene of attack A police officer stands guard outside a branch of the Italian chain restaurant Zizzi where the pair dined at before falling ill. It was boarded off whilst investigators worked on the building and later found traces of the chemical weapon within it. AFP/Getty Skripal attack aftermath – in pictures Scene of attack Large areas of central Salisbury were cordoned off by police following the discovery of the Skripals. Traces of nerve agent were also found in The Mill pub. PA Skripal attack aftermath – in pictures Victim - Nick Bailey Detective Sergeant Nick Bailey, rushed to the aid of the Russian ex-spy and his daughter who were targeted with a nerve agent. He was hospitalized after aiding them and didn't leave until three weeks after the attack. Wiltshire Police/Rex Skripal attack aftermath – in pictures Police investigation - Skripal’s home Police believe they were poisoned at home, and detectives found the highest concentration of novichok on the front door of Mr Skripal’s house. Getty Skripal attack aftermath – in pictures Theresa May visits scene of attack Britain's Prime Minister Theresa May spokes with Wiltshire Police's Chief Constable Kier Pritchard near where the Skripal's were found. Britain expelled 23 Russian diplomats over the nerve agent poisoning and suspended high-level contacts, including for the World Cup on March 14. Theresa May told parliament that Russia had failed to respond to her demand for an explanation on how a Soviet-designed chemical, Novichok, was used in Salisbury. AFP/Getty Skripal attack aftermath – in pictures Skripal days before attack Sergei Skripal days before he was exposed to Novichok, that has left him fighting for life. ITV News Skripal attack aftermath – in pictures Police investigation - military involvement British soldiers were deployed soon after the attack to help a counter-terrorism investigation into the nerve agent attack. One of the places they were asked to help out with was Skripal's home and it's surrounding. They were asked to remove a vehicle connected to the agent attack in Salisbury, from a residential street in Gillingham. AFP/Getty Skripal attack aftermath – in pictures Police investigation Personnel in protective coveralls and breathing equipment cover an ambulance with a tarpaulin at the Salisbury District Hospital. AFP/Getty Skripal attack aftermath – in pictures Police investigation The investigation extended to the grave of Sergei Skripal's son Alexander in London Road cemetery. Getty Skripal attack aftermath – in pictures Police investigation The Counter Terrorism Policing Network requested assistance from the military to remove a number of vehicles and objects from Salisbury. EPA Skripal attack aftermath – in pictures Home Secretary visits scene of attack Home Secretary Amber Rudd visited the scene of the nerve agent attack at the Maltings shopping centre on 9 March. Getty Skripal attack aftermath – in pictures Yulia Skripal speaks for the first time Yulia Skripal, speaking for the first time, said she felt lucky to have survived the nerve agent attack in Salisbury which left her fighting for life. Ms Skripal said her life had been “turned upside down” by the assassination attempt. But the Russian national added she hoped to return to her homeland one day, despite the Kremlin being blamed for the attack. Reuters

Russian ambassadors are also keen to note that French investment in the Russian economy is growing, having reached more than $14 billion, while Russia's direct investment in France is $3.2 billion, according to figures put out on RT.

More straightforwardly, French scepticism of the claims of British intelligence is nothing new, as anyone who remembers the run-up to the Iraq war will know. But for France, the stakes of alienating Russia are simply higher.

Britain’s economic relationship with the country mostly involves Russian big money coming to London, a relationship that doesn’t seem likely to be endangered by anything Theresa May says about Vladimir Putin. This is arguably not the case for France, explaining its initial caution – even if after international pressure, it lined up behind its allies.

This article has been updated to reflect the joint statement on Thursday",neutral,1
https://sputniknews.com/military/201804151063590931-bz-chemical-top-5/,979,705,"The mostly non-lethal agent is colorless, odorless, and practically insoluble in water, and very powerful. When used as an aerosol (the most common method of application), BZ is absorbed through the respiratory system; it can also be absorbed through the skin or digestive system. It takes about one hour for the agent to begin to take effect, with peak effect reached after 8-10 hours.

According to the Handbook of Toxicology and Chemical Warfare (2015), less than one milligram of BZ administered orally results in incapacitation for several days. Symptoms of exposure to the drug include delirium, tremors, stupor, hallucinations, ""and coma that can last for more than 2 days."" Other symptoms include paranoia and mania.

Tested By (and On) US Troops

After finding out about the chemical's existence, the US Army began testing 3-Quinuclidinyl benzilate on its troops. Maryland's Edgewood Arsenal experimented with BZ, along with LSD, THC, ketamine, opioids and other drugs on hundreds of military personnel and civilians into the mid-1970s. Originally designated 'TK', the chemical agent received the NATO designation BZ in 1961.

Weaponized in 1962

The US Army Chemical Corps weaponized BZ in 1962, mass producing the agent and packing it into the M44 smoke generator cluster and M43 BZ cluster bombs for use against squad or company-sized enemy forces. Between 1962 and 1988, 1,500 M44 and M43 rounds were produced, and stored at the Pine Bluff Arsenal in Jefferson County, Arkansas.",neutral,1
http://www.bbc.com/news/uk-43770102,992,710,And no surprise either that Downing Street should choose to publish so swiftly a summary of the legal advice it has received - in order to avoid the sort of damaging criticism suffered by the Blair government over its refusal to do so.,neutral,1
http://www.dailymail.co.uk/news/article-5492733/Suspicious-masked-woman-spotted-Salisbury-spy-collapsed.html,993,711,"A masked woman was seen acting suspiciously in Salisbury an hour before the Skripals were found collapsed, police have been told.

The dark-haired woman was spotted wearing a black face mask as she left a Pret a Manger, a three-minute walk from where Sergei Skripal, 66, and his daughter Yulia, 33, were later found convulsing and vomiting.

At the time the pair were thought to be in the Mill pub a few yards away.

A police officer stands at a cordon as soldiers wearing protective suits and members of the emergency services work at a site in Winterslow

Investigators in protective clothing remove a van from an address in Winterslow near Salisbury, as police and members of the armed forces continue to investigate the suspected nerve agent attack on Russian double agent Sergei Skripa

Anti-terror police also took over a Sainsbury's car park in Salisbury as part of the rapidly expanding chemical attack probe

The investigation into the poisoning has led to a series of locations around Salisbury being sealed off and decontaminated

Yesterday chemical warfare experts locked down a nearby village amid fears that Mr Skripal’s car could contain traces of the nerve agent that has left him fighting for his life.

Army and police vehicles and ambulances rolled into West Winterslow just after lunchtime before investigators in hazardous material suits and gas masks loaded a white transit van on to a flatbed truck. The van’s driver was also asked to hand over his clothes, it was claimed.

The masked woman spotted on Sunday had been carrying a large bag, according to Mark Francis, a car dealer, who reported the incident to police on Wednesday.

Mr Francis said the mask could have been used to protect the identity of an assassin.

Counter-terror police have not yet released images of any potential suspects despite claims the centre of the city is covered by a new high-definition CCTV system.

Mr Francis said he initially thought nothing of the black mask, which is of the type that became a familiar sight after the outbreak of Severe Acute Respiratory Syndrome (Sars) in 2002.

But after it was revealed that nerve agents were used in the assassination attempt, he reported what he had seen.

Mr Francis, 50, said: ‘We were in the town centre in Pret a Manger. We were in there at 3.35pm and I was sitting by the door and this lady walked out at 3.40pm.

‘She was wearing a Sars mask, a black Sars mask tucked around her chin and a bag in her hand.

‘It was really odd as you don’t often see someone wearing a Sars mask in Salisbury. We don’t get smog or pollution. When it became a chemical attack it sounded more likely that it could be significant.

‘She had dark hair, a single woman, but I didn’t think she was obviously Asian.’

Locals have said chemical weapons experts are removing a potentially contaminated vehicle from a local business

On Sunday it was reported that a witness told police that an hour before the couple collapsed he saw a ‘man in a mask’ with his hood up acting suspiciously nearby.

The witness said: ‘He looked threatening and aggressive and he was walking towards us with purpose. He gave me a stern look as he passed us by about 100 yards from the bench where they found the Russians.’

The white transit van which was taken from West Winterslow, five miles from the centre of Salisbury, is thought to have been used to tow away Mr Skripal’s BMW – and could also contain traces of the deadly toxin. The van was parked outside the home of Robert Horner, 22 who neighbours said works for Ashley Wood Recovery.

Mr Horner is also believed to have handed over his clothes to investigators. Neighbour Robbie Williams, 54, said: ‘They took all the guy’s clothes.’

Five specialists in breathing apparatus removed the van in a painstaking operation taking more than five hours. Earlier, counter-terrorism police including one wearing a balaclava cordoned off the top floor of a Sainsbury’s car park in Salisbury where it was believed Mr Skripal had parked his BMW before eating at a Zizzi restaurant on Sunday with his daughter.

It is thought the maroon car was taken to the Ashley Wood Recovery centre on Thursday, where it was examined by hazmat teams.",neutral,1
https://www.bloomberg.com/news/articles/2018-04-13/corbyn-s-popular-anti-war-stance-compounds-risk-for-may-on-syria,1005,721,"Why did this happen?

Please make sure your browser supports JavaScript and cookies and that you are not blocking them from loading. For more information you can review our Terms of Service and Cookie Policy.",neutral,1
