Id,index1,cluster,text,stance,stance_enc
https://www.washingtonpost.com/news/worldviews/wp/2018/03/26/who-poisoned-sergei-skripal-not-russia-russians-say/,816,312,"Gift Article Share

Earlier this month, Sergei Skripal and his adult daughter, Yulia, were found unconscious on a park bench in Salisbury, England. The two had been poisoned with a nerve agent called Novichok, developed by Kremlin scientists several decades ago. They remain in critical condition. Wp Get the full experience. Choose your plan ArrowRight Skripal is Russian. He was arrested in 2006 for passing state secrets to Britain's MI6 and released in 2010 as part of a prisoner swap. He's been living in Britain ever since.

After an investigation, British officials accused the Kremlin of organizing the March 4 attack, which is thought to have exposed as many as 130 people to the nerve agent. At least 50 were treated in a hospital. In a statement to the House of Commons on March 12, Prime Minister Theresa May said it was “highly likely” that Russian officials organized the poisoning.

Advertisement

In response, Britain has called for international consequences.

On Monday, the world got a better sense of what those consequences might look like. In a coordinated announcement, several European countries booted Russian diplomats from their soil. Around the same time, President Trump announced that he would do the same. He expelled 60 Russian diplomats from the United States and said he plans to shutter Russia's consulate in Seattle.

In 1992, two Russian scientists approached The Post’s Will Englund, then the Moscow correspondent for the Baltimore Sun, with news of a secret nerve agent. (Video: Joyce Lee, Will Englund/The Washington Post)

“Today’s extraordinary international response by our allies stands in history as the largest collective expulsion of Russian intelligence officers ever & will help defend our shared security,” British Foreign Secretary Boris Johnson wrote on Twitter. “Russia cannot break international rules with impunity.”

The Kremlin, however, has maintained its innocence, saying at one point that Britain's accusations “border on banditry.” Russia's ambassador to the European Union, Vladimir Chizhov, told reporters that “the Russian state had nothing against” Skripal. Russian leaders have also pointed fingers elsewhere, suggesting that the United States or Britain is trying to frame the Kremlin in a bid to inflame Russiaphobia.

Advertisement

Experts say Russian Twitter trolls are working overtime to amplify this message, alleging that potentially fake accounts linked to a bot factory in St. Petersburg have been sharing social media posts that cast doubt on the British investigation. In one instance, according to experts, trolls circulated a poll that asked whether May had provided the public with enough information.

Ben Nimmo, a senior research fellow at the Atlantic Council, said that after the attack, he saw an “attempt by pro-Russian users to influence the online poll, and thus to create the appearance of greater hostility towards the U.K. government than U.K. users themselves showed.”

By some measures, the campaign is working, at least in Russia. In a phone survey conducted by state-run pollster Russian Public Opinion Research Center, 82 percent of those surveyed had heard about the poisoning of the Skripals. Of that group, just 5 percent said they believed that Britain's allegations against the Kremlin were credible.

Advertisement

About 81 percent agreed that Britain is “ready to use any chance to deepen the crisis in relations with Russia.” Additionally, 59 percent said they would support Moscow's participation in an international investigation of the poisoning.

In response to the latest diplomatic dust-up, the Russian Embassy in Washington tweeted a cheeky poll Monday asking which U.S. consulate Russia should shutter.

US administration🇺🇸 ordered the closure of the Russian Consulate in Seattle @GK_Seattle🇷🇺. What US Consulate General would you close in @Russia, if it was up to you to decide — Russian Embassy in USA 🇷🇺 (@RusEmbUSA) March 26, 2018

As of about 1:30 p.m., 45 percent of the 13,000 voters had opted for the closure of the U.S. Consulate in St. Petersburg. Thirty-five percent chose Yekaterinburg.

GiftOutline Gift Article",anti-russian,0
http://time.com/5199472/skripal-russia-uk-strength-poison/,835,48,"There can be little doubt that the Russian government is behind the attempted assassination of double agent Sergei Skripal and his daughter. While there were the typical official denials, the Russian state has ways of communicating its innocence to foreign governments. In this case, it has not done so.

The use of a nerve agent fits a pattern established by the murder of Alexander Litvinenko with polonium in 2006. This was not a McMafia-style operation commissioned by “rogue elements.” If they were to blame, Moscow would be even more alarmed than London. Since the chaos of the 1990s, Putin has restored the state’s traditional prerogatives in foreign covert operations, as well as the president’s prerogatives within it. This was graphically demonstrated in Crimea in early 2014 with the deployment of “little green men.”

But what could be the motive? The Russians think strategically and will have planned this operation carefully in terms of both its execution and impact. What it says to Russians living in the U.K. or those thinking of leaving the country is: disloyalty is always punishable, you will never be free of us and you will never be safe, wherever you live. Singling out the reclusive 66-year old Skripal, eight years after he came to the U.K. and had run out of secrets to tell, simply underlines the point: you do not have to be an arch enemy of the Putin system to be in potential danger, and your family may also be a target.

What it says to the British government led by Theresa May is: we believe you are weak, and we have no respect for you. In recent years, successive British governments have repeatedly communicated weakness to Russia without any intention of doing so.

First, even before the suspicious “suicide” of dissident oligarch Boris Berezovsky in 2013, the U.K. authorities had been singularly lackluster in prosecuting a macabre string of suspect deaths of Russian exiles on British soil. Until 2014, the government resisted a public inquiry into the death of Alexander Litvinenko, signaling that it was disinclined to name and shame Russia for fear of harming attempts to rebuild ties.

Second, Russia viewed the Strategic Defense and Security Review (SDSR) of 2010 as an abdication of Britain’s great power role. The winding down of a fair portion of the U.K.’s maritime reconnaissance and warfare capability in northern waters was regarded with incredulity. The SDSR’s 2015 successor has repaired much of the damage to U.K. defense capacities, but this scarcely has registered in Moscow.

Third, David Cameron’s government chose to absent itself from the Russia–Ukraine “Minsk process,” leaving the running to Paris and Berlin. Given the U.K.’s prominent role in securing the rights and assurances that underpinned Ukraine’s independence and territorial integrity (including its signature on the 1994 Budapest Memorandum), London effectively communicated to Moscow that Ukraine had become a lesser priority and that Britain had better things to do. Although the U.K.’s vigorous defence advisory effort has earned plaudits in Kiev, Russia no longer considers Britain to be a serious player in Ukraine.

Fourth, there is Brexit, which many of its supporters believe will strengthen Britain’s global influence. Whatever the merits of that claim, the Russians view Brexit as a case of the U.K. cutting off its nose to spite its face. From the earliest days of the Cold War, the USSR and its Russian successor viewed Britain as Washington’s number one proxy in Europe. From Moscow’s perspective, the U.K.’s position at the EU top table enhanced U.S. and British influence simultaneously. That advantage has been thrown away.

For these reasons, the Skripal affair is not only a reflection of perceived weakness. It is also a test. If the U.K chooses to act toughly, will its allies support it or simply send their best wishes? This latest example of Russian “reconnaissance by combat” puts Britain into a bind.

Fortunately, whatever the allied response, the U.K. is the repository of a national asset of very high value to Russia: the City of London. For many years, it has effectively allowed key Russian stakeholders to use the services of the City – in particular, the London Stock Exchange, as well as the high-end property market – for purposes legitimate, illegitimate and even illegal.

It is time to transform them from a source of advantage to Russia to a strategic asset for the U.K. Doing so will require proper analysis, coordination (including the security services, the Treasury and the Serious Fraud Office) and dedicated resources. Asset freezes, money laundering investigations and selective cancellation of visas for individuals and their families who are either part of the regime or support it will cause real pain in Moscow. Impulsive and symbolic measures will not do the same.

Leon Trotsky once said, “You might not be interested in war, but war is interested in you.” Today’s Russian leadership, political and military, believes it is at war with the West. It is not a war dominated by artillery and tanks, but by finance and social media, with huge opportunities for covert action from disinformation to assassination. As Russia’s Ministry of Defense stated in 2011, to prevail in these new conditions requires “destabilizing the society and state, and forcing the state to make decisions in the interests of the opposing party.” That is the test the U.K. faces.

This piece was originally published by Chatham House, the London-based think-tank for international affairs.

Contact us at letters@time.com.",anti-russian,0
http://foreignpolicy.com/2018/03/21/theresa-may-should-go-after-putins-debt/,893,653,"Russia’s response, as it turns out, was defiant. The headline was the Kremlin’s decision to expel 23 British diplomats, close the British Council in Russia , and close the U.K. Consulate in St. Petersburg. The move that got far less attention, however, was more significant: a brazen flaunting of the Western sanctions regime imposed on Russia since 2014 for its annexation of Crimea and its destabilizing activities in eastern Ukraine. Last week, in the middle of the U.K.-Russia diplomatic row, Russia issued $4 billion in Eurobonds, half of which were purchased in the United Kingdom.

The United Kingdom has already expelled 23 Russian diplomats and secured a joint statement with France, Germany and the United States that the attempted murder on British soil of Sergei Skripal, a former Russian spy, and his daughter, Yulia, using a military-grade nerve agent on March 4 was “highly likely” to have been perpetrated by Russia. This might have been the start of a serious response, with tougher measures to follow depending on Russia’s reaction.

The British government appears to have backed down against Russia in the Skripal affair. It’s the wrong move. The U.K. government should have hit back harder, and can still do so.

The British government appears to have backed down against Russia in the Skripal affair. It’s the wrong move. The U.K. government should have hit back harder, and can still do so.

The United Kingdom has already expelled 23 Russian diplomats and secured a joint statement with France, Germany and the United States that the attempted murder on British soil of Sergei Skripal, a former Russian spy, and his daughter, Yulia, using a military-grade nerve agent on March 4 was “highly likely” to have been perpetrated by Russia. This might have been the start of a serious response, with tougher measures to follow depending on Russia’s reaction.

Russia’s response, as it turns out, was defiant. The headline was the Kremlin’s decision to expel 23 British diplomats, close the British Council in Russia, and close the U.K. Consulate in St. Petersburg. The move that got far less attention, however, was more significant: a brazen flaunting of the Western sanctions regime imposed on Russia since 2014 for its annexation of Crimea and its destabilizing activities in eastern Ukraine. Last week, in the middle of the U.K.-Russia diplomatic row, Russia issued $4 billion in Eurobonds, half of which were purchased in the United Kingdom.

The failure to sanction the issuance of new Russian sovereign debt has been a key weakness in existing EU and U.S. sanctions for at least two reasons.

First, existing sanctions target Kremlin-linked banks and energy companies to pressure the Russian government but not the state itself, whose sovereign debt can be bought by EU and U.S. entities. While Russia has relatively low public debt levels ($122 billion in domestic debt and $38 billion in Eurobonds as of the end of the third quarter of 2017), it still needs to issue hard currency debt to service its external debt obligations.

Second, while the sanctions regimes prevent targeted banks and energy companies from issuing their own debt in European and U.S. capital markets (with some narrow exceptions for short-term debt), sanctioned banks such as VTB Bank have been able to act as book runners (that is, the main organizers) for the issuance of Russian sovereign debt that can be bought in the European Union and the United States.

On Tuesday, as the U.K. national security council met to decide on what steps to take next, the reality of the country’s diplomatic isolation was hitting home, with President Donald Trump and President of the European Commission Jean-Claude Junker both having sent oleaginous congratulations to Putin for his recent re-election win. On Wednesday morning, the U.K. government announced it would ask for no further sanctions against the Russia state, but rather take action against Putin’s cronies and their dirty money in the United Kingdom. And the actions mentioned — “more security checks on private flights” and the like — will hardly keep those cronies awake at night.

The problem with the U.K. government’s response is that they are trying to use ordinary law enforcement to push back against the Russian hybrid threat. Of course, the government should move against dirty Russian money in the United Kingdom, but this is just to say that it should move against dirty money in the country in general: being a Russian national in the United Kingdom isn’t a crime, and nor is being a wealthy Russian national.

The crux of the matter is that the U.K. government is wrong to think it can push back against the Russian hybrid threat by focusing narrowly on the private actions of Putin’s entourage. This follows from the plain fact that these people occupy key positions in the Russian state, and state-linked companies. To counter the Russian hybrid threat, the United Kingdom and its Western partners need to hit back against the Russian state itself. In the immediate term, while it’s clear that there won’t be new sanctions, London should at least push to fix the weakness in the existing sanctions regimes against Russia as regards new sovereign debt issuances.

The easiest way to do that is to break the link between Russian sovereign debt and key Western clearing houses, such as Euroclear and Clearstream. At present, Russia can borrow in EU and U.S. capital markets despite Western sanctions and then can support the sanctioned Kremlin-linked banks and energy companies that can no longer do so. For instance, in July 2016, two months after Russia issued its first Eurodollar bond since the 2014 sanctions, it was made available on Euroclear. If Russian bonds were no longer available on such clearing houses, they would effectively be untradeable on the secondary market, which would deter the majority of EU and U.S. investors from buying them.

This can be achieved though re-interpretation, or slight modification, of the exiting sanctions regimes, which were ambiguous on the question of whether clearing houses would make Russian sovereign bonds available. Clearstream was well aware that it had been burnt for breaking the Iranian sanctions regime, and had to pay a $152 million fine to the U.S. Treasury in 2014. Nevertheless, in July 2016, two months after Russia issued its first Eurodollar bond since the 2014 sanctions, it was made available on Euroclear, surmounting the final obstacle to the Russian state accessing EU and U.S. capital markets.

Tightening existing sanctions in this way would also serve to strike against Russian dirty money in the United Kingdom. Last week’s Russian Eurobond week was different from previous issuances in the way it was designed to allow Russian investors to repatriate money held abroad and was expressly advertised as such by the head of VTB Bank, which acted as the book runner, and Putin himself.

Of course, the main problem remains that the U.K. is unlikely to get support from the United States or the EU at this time (note that London’s sanctions works within the EU sanctions regime).

On the U.S. side, the Trump administration is clearly reluctant to toughen existing sanctions on Russia. One reason for this is that it would disrupt financial markets, which would harm U.S. investors as well as the Russian state, as a key U.S. Treasury report stated in late January as part of a justification not to sanction Russian sovereign debt. One could argue this simply puts the interests of the U.S. economy first. But it also represents a spineless refusal to stand up to a mafia state. Indeed, it all but confirms Putin’s assumption that Western leaders are so nervous about upsetting financial markets that they will forfeit the only serious weapon they have to push back on illegal Russian activity short of military means. Of course, there is also President Donald Trump’s own strange deference to Putin in the background and links between his businesses and VTB Bank to consider.

On the European side, the U.K. has less influence given its imminent departure from the EU, and the EU itself is internally split on whether to upgrade or tone down Russian sanctions. However, while the sight of a President of the EU Commission congratulating a dictator on his election victory presents a vision of decay, there are braver voices willing to stand up for democracy against the Russian hybrid threat. For example, European Parliamentarian Guy Verhofstadt tweeted that “This is no time for congratulations. We will always need dialogue with Russia, but closer ties must be conditional on respect for the rules based international order & fundamental values”. Exactly right.

Realistically, the United Kingdom might not be able to get the existing sanctions regimes tweaked to cover new Russian sovereign debt issuance this time around, given the wider diplomatic situation. But London would be wrong to think that pushing for this now would display the London’s isolation, and the West’s disunity in the face of the Russian hybrid threat. Rather, it is the right moment for the United Kingdom to stand up for the move, and place the burden of explanation on those who think that it is fine for the West’s financial system to be used to finance a state that clearly presents a threat to Western democracies. The U.K. should lead the way in rejecting the passivity that has characterized Western enforcement of sanctions against Russia since 2014, and puncture Moscow’s assumption that the West will ultimately put financial interests before its public values.",anti-russian,0
https://www.rt.com/news/422342-germany-poland-diplomats/,903,312,"Half of the European Union's member states have decided to expel Russian diplomats over the Sergei Skripal case, European Council president Donald Tusk confirmed. It comes despite zero evidence that Moscow was responsible.

Germany, France, and Poland topped the charts of EU countries making expulsions, announcing they would each be sending four Russians out of their respective countries.

Lithuania and the Czech Republic both announced they would be expelling three diplomats. Meanwhile the Netherlands, Denmark, Italy, and Spain jumped on board with two expelled diplomats per country.

Finland, Sweden, Romania, Croatia, and Hungary are expelling one each. Latvia also announced that it would be expelling one diplomat and an Aeroflot employee, and Estonia's foreign minister confirmed the country would be expelling a military attaché at the Russian embassy.

Ukraine, which is not an EU member state, announced it would be expelling 13 diplomats. Albania, another country which is not part of the bloc, said it would be expelling two. Norway said it would expel one.

Meanwhile, Iceland also said it is temporarily suspending its bilateral contacts with Russia at the highest level, TASS news agency reported, citing the Russian envoy to the country.

Further afield, Donald Trump has ordered the expulsion of 60 Russian diplomats from the United States, as well as the closure of the Russian consulate in Seattle.

Moscow will respond to the actions of each individual state that has expelled Russian diplomats, Foreign Ministry spokeswoman Maria Zakharova said.

“Necessary steps will be made regarding each country involved, both on the diplomats’ expulsion, and on the closure of the Russian Consulate General in Seattle,” she promised.

Meanwhile, Austria said it won’t be joining the punitive measures against Russia, according to government spokesperson Peter Launsky-Tieffenthal. “We are determined to maintain open channels of dialogue with Russia,” he told RIA Novosti, adding that Austria is a “neutral country and a sort of bridge between the East and the West.” Vienna, however, stands by the decision to recall the EU’s ambassador from Russia, he added.

Western countries have pointed the finger at Russia over the poisoning of Skripal, a former double-agent, and his daughter Yulia in Salisbury, UK on March 4. British Foreign Minister Boris Johnson went so far as to suggest the attack was ordered by Russian President Vladimir Putin.

Russia has denied playing a role in the poisoning, and has offered its full cooperation in the investigation. Moscow’s request for samples of the toxic agent used on Skripal and his daughter has been declined by Britain.",anti-russian,0
